[
  {
    "id": "painter_001",
    "name": "Maya Thompson",
    "primary_medium": "painting",
    "style_description": "Maya creates large-scale oil paintings about migration, memory, and family archives, often combining portraiture with domestic interiors.",
    "themes": ["memory", "portraiture", "migration", "identity", "interiors"],
    "budget_cap_usd": 45,
    "minimum_days_until_deadline": 10,
    "career_goal": "exhibition exposure and institutional recognition",
    "eligible_regions": ["US", "International"],
    "career_stage": "emerging",
    "geographic_preferences": ["US", "Europe"],
    "eligibility_constraints": ["non-student"],
    "artwork_image_paths": []
  },
  {
    "id": "painter_002",
    "name": "Daniel Ruiz",
    "primary_medium": "painting",
    "style_description": "Daniel paints urban night scenes and layered architectural abstractions with a focus on public space, light, and social atmosphere.",
    "themes": ["city", "architecture", "public space", "light", "abstraction"],
    "budget_cap_usd": 30,
    "minimum_days_until_deadline": 7,
    "career_goal": "visibility and CV building",
    "eligible_regions": ["US", "Canada", "International"],
    "career_stage": "mid-career",
    "geographic_preferences": ["US", "Canada"],
    "eligibility_constraints": [],
    "artwork_image_paths": []
  },
  {
    "id": "painter_003",
    "name": "Leah Brooks",
    "primary_medium": "painting",
    "style_description": "Leah works in acrylic and gouache, painting ecological change, wetlands, birds, and botanical systems with a research-driven approach.",
    "themes": ["ecology", "landscape", "botanical", "birds", "climate"],
    "budget_cap_usd": 20,
    "minimum_days_until_deadline": 14,
    "career_goal": "community engagement and environmental exhibition exposure",
    "eligible_regions": ["US", "International"],
    "career_stage": "emerging",
    "geographic_preferences": ["US"],
    "eligibility_constraints": [],
    "artwork_image_paths": []
  },
  {
    "id": "painter_004",
    "name": "Nadia El-Sayed",
    "primary_medium": "painting",
    "style_description": "Nadia makes figurative and symbolic paintings on linen exploring ritual, myth, and contemporary diasporic identity.",
    "themes": ["ritual", "myth", "diaspora", "figurative", "symbolism"],
    "budget_cap_usd": 60,
    "minimum_days_until_deadline": 21,
    "career_goal": "prestige and international exhibition exposure",
    "eligible_regions": ["US", "UK", "Europe", "International"],
    "career_stage": "mid-career",
    "geographic_preferences": ["Europe", "UK"],
    "eligibility_constraints": [],
    "artwork_image_paths": []
  },
  {
    "id": "painter_005",
    "name": "Owen Park",
    "primary_medium": "painting",
    "style_description": "Owen paints materially experimental abstract works focused on process, color fields, and gestural mark-making.",
    "themes": ["abstraction", "color", "gesture", "materiality", "process"],
    "budget_cap_usd": 15,
    "minimum_days_until_deadline": 5,
    "career_goal": "sales and gallery visibility",
    "eligible_regions": ["US", "International"],
    "career_stage": "emerging",
    "geographic_preferences": ["US", "Remote"],
    "eligibility_constraints": [],
    "artwork_image_paths": []
  }
]
